{
  "schemaVersion": 1,
  "updatedAt": "1970-01-01T00:00:00.000Z",
  "project": {
    "name": "Example Project",
    "identity": "Generic source-backed project continuity snapshot"
  },
  "stableGoals": [
    "Keep durable context bounded and supported by selected committed sources"
  ],
  "implementationBoundaries": [],
  "operatingRules": [],
  "activeWork": [],
  "decisions": [
    {
      "summary": "Use the committed example anchor as the source for this demonstration",
      "status": "documented example",
      "sourceRefs": [
        "examples/source-anchor.md"
      ]
    }
  ],
  "recentWork": [],
  "validationEvidence": [],
  "unresolvedItems": [],
  "nextSteps": [],
  "sourceRefs": [
    {
      "path": "examples/source-anchor.md",
      "purpose": "Generic committed documentation anchor used by the source-backed example",
      "contentSha256": "2764eadbc23252f640f289b9f500a1a4bbb86cb8ebd83703520ec2353dff40e5"
    }
  ],
  "workspace": {
    "head": "unavailable",
    "branch": "unavailable",
    "dirty": false,
    "statusFingerprint": "0000000000000000000000000000000000000000000000000000000000000000",
    "fingerprintPartial": false,
    "capturedAt": "1970-01-01T00:00:00.000Z"
  }
}
