{
  "schemaVersion": 1,
  "updatedAt": "1970-01-01T00:00:00.000Z",
  "project": {
    "name": "Project",
    "identity": "Bounded project continuity snapshot"
  },
  "stableGoals": [],
  "implementationBoundaries": [],
  "operatingRules": [],
  "activeWork": [],
  "decisions": [],
  "recentWork": [],
  "validationEvidence": [],
  "unresolvedItems": [],
  "nextSteps": [],
  "sourceRefs": [],
  "workspace": {
    "head": "unavailable",
    "branch": "unavailable",
    "dirty": false,
    "statusFingerprint": "0000000000000000000000000000000000000000000000000000000000000000",
    "fingerprintPartial": false,
    "capturedAt": "1970-01-01T00:00:00.000Z"
  }
}
